umn_plantID,common_name,scientific_name,height,spread,form,seasonal_interest,seasonal_interest_specific,flower_color,landscape_use,light,zone,soil,notes883,Lemon Lights Azalea,Rhododendron,5 ft,4 ft,Rounded,Spring,Spring flowers are bicolor - light yellow on edges of petals and a golden throat. Fall foliage is maroon/bronze color.,Yellow,Border,Full sun;      Part sun,"4, 5, 6, 7", ,Introduced by the University of Minnesota. UMN Release 1996.1917,Lemon Lollypop Daylily,Hemerocallis,24 in,  in,Upright;     Mound,Early summer;      Late summer;      Mid-summer,"Summer fragrant 4"" yellow flowers",Yellow,Border;      Boulevard planting,Full sun;      Part sun,"3, 4", ,Rebloomer Diploid.1847,Lemon Queen Perennial Sunflower,Helianthus,72 in,36 in,Upright,Early fall;      Late summer,"2-3"" wide flowers on tall plant.",Yellow,Border;      Pollinator garden;      Screen,Full sun,"4, 5, 6, 7, 8, 9", ,Late summer blooming perennial that attracts butterflies and provides cutflowers. Do not over-fertilize or over water. Good for pollinators.2726,Lemon Thyme,Thymus citriodorus,12 in,12 in, ,Early summer; Mid-summer; Late summer,Light green lemon scented foliage with tiny pink flowers,Pink,Border; Butterfly garden; Cutting; Drying; Edible landscape; Fragrance; Ground cover; Herb garden; Pollinator garden; Rock garden,Full sun,"3, 4, 5, 6, 7, 8",Prefers evenly-moist; Prefers well-drained,Good for pollinators.1371,Lemon Verbena,Aloysia triphylla,6 in,8 in,Upright,Late summer; Early fall,Aromatic lanceolate foliage. Semi-woody stem.,Pink,Container; Cutting; Drying; Edible landscape; Fragrance; Herb garden,Full sun,Annual, ,Edible. Leaves (fresh or dried) can be used for delicious lemon tea.1866,Lenten Rose,Helleborus orientalis,18 in,24 in,Clump; Mound; Upright,Early spring; Mid-spring; Late spring; Early summer; Mid-summer; Late summer; Early fall; Mid-fall; Late fall; Winter; Year-round,Evergreen foliage. Cup-shaped flowers range from pure white to purple,Bicolor; Black; Burgundy; Chartreuse; Coral; Cream; Green; Maroon; Mauve; Pink; Purple; Rose; White,Border,Full shade; Part shade; Part sun,"4, 5, 6, 7, 8",Prefers evenly-moist; Prefers well-drained; Tolerates alkaline,Various cultivars. Some hardy only to Zone 52212,Leopard Plant,Ligularia przewalskii,30 in,18 in,Upright,Late summer, , ,Border; Pollinator garden,Part sun,"4, 5, 6, 7, 8",Prefers evenly-moist; Prefers loam, 663,Lewis Mockorange,Philadelphus,6 ft,5 ft,Upright,Spring,Summer white flowers; summer gold foliage.  Blooms on old wood.,White,Border;      Foundation planting,Full sun;      Part sun,"4, 5, 6, 7, 8",Prefers well-drained, 219,Liberation  Clematis,Clematis,10 ft,3 ft,Climbing; Twining, , ,Pink,Focal point; Fragrance; Screen,Full sun; Part sun,"3, 4, 5, 6, 7, 8, 9",Prefers evenly-moist; Prefers high organic matter; Prefers well-drained,Large flowers are deep pink with a broad cerise central bar and contrasting yellow anthers.  Free flowering. (CPBR #1989)562,Liberty Apple,Malus,15 ft,10 ft, ,Spring; Fall,White spring flowers. Medium-sized fruit.,White,Edible landscape; Fruit; Pollinator garden,Full sun,"4, 5, 6, 7",Prefers acidic; Prefers well-drained,New York  1979. Crisp and juicy with a well-balanced flavor. Keeps well into February. Fresh eating and cooking. Good for pollinators. Blooms on old wood.1852,Licorice Plant,Helichrysum petiolare,12 in,14 in,Upright,Spring;     Summer,Grown for dusty white leaves, ,Border;     Container,Full sun;     Part sun,Annual,Tolerates dry, 2649,Lidakense Stonecrop,Sedum cauticola,8 in,18 in,Mound;     Spreading,Late summer;      Mid-summer,Purple edged blue-grey foliage,Pink,Border;      Boulevard planting;      Pollinator garden;      Rock garden,Full sun,"4, 5, 6, 7, 8", ,Good for pollinators.1317,Lilac Beauty Yarrow,Achillea millefolium,24 in,18 in,Clump; Upright,Early summer; Mid-summer; Late summer,Flowers are lilac pink,Pink; Purple,Border; Boulevard planting; Butterfly garden; Cutting; Drying; Foundation planting; Natural planting; Pollinator garden; Prairie planting,Full sun,"3, 4, 5, 6, 7, 8",Adaptable; Prefers well-drained; Tolerates alkaline; Tolerates dry,Cutting flowers before pollen develops will retain color when dry. Good for pollinators. Nectar source for adult monarchs.1814,Lilac Cranesbill,Geranium ibericum,18 in,18 in,Mound,Early summer;      Mid-summer, ,Pink;  Purple,Border;      Pollinator garden,Full sun;      Part sun,"4, 5, 6, 7", ,Good for pollinators.905,Lilac Lights  Azalea,Rhododendron x,4 ft,4 ft,Rounded,Spring,Abundant non-fading;  lilac colored flowers in mid-spring. Yellow fall foliage.,Lilac,Border;      Foundation planting,Full sun;      Part sun,"4, 5, 6, 7",Prefers acidic,Introduced by the University of Minnesota. Improved form of 'Orchid Lights' - more uniform  semi-dwarf habit plus a more abundant flowering. UMN Release 2001.1168,Lilac Sunday Lilac,Syringa xchinensis,12 ft,12 ft,Arching, ,Single pale purple fragrant spring flowers. Flower panicles grow at the tips of the branches as well as the lateral buds along the stems at a distance of two or more feet from the branch tips. The effect is willowy;  arching branching and the flowers appear much longer.,Lavender,Border; Pollinator garden,Full sun,"4, 5, 6, 7", ,An introduction from the Arnold Arboretum of Harvard University. Good for pollinators.1616,Lily of the Valley,Convallaria majalis,8 in,8 in,Upright,Late spring; Early summer,Fragrant;  white;  bell-shaped flowers hide among foliage in spring.,White,Cutting,Full shade; Part shade; Part sun,"3, 4, 5, 6, 7",Adaptable; Tolerates dry,Can develop orange-red berries which are poisonous. Can be planted under trees; tolerates dry shade conditions.728,Limber Extra Blue Pine,Pinus flexilis,40 ft,30 ft,Pyramidal,Spring;      Summer;      Fall;      Winter;      Year-round,soft blue-green needles, ,Border;      Rock garden,Full sun,"3, 4, 5, 6, 7", ,A Limber pine noted for its striking blue color. Young irregular upright form with dense tufted branching becomes pyramidal as it matures1405,Lime Frost Columbine,Aquilegia,18 in,18 in,Upright;     Clump,Late spring;      Early summer,variegated leaves that are gray-green with cream variegation.,Purple,Border,Part sun;      Part shade;      Full shade,"4, 5, 6, 7, 8", , 486,Lime Glow Juniper,Juniperus horizontalis,3 ft,5 ft,Mound,Spring; Summer; Fall; Winter; Year-round,New growth is chartreuse yellow. Foliage turns copper/bronze in late fall and winter., ,Focal point; Foundation planting,Full sun,"3, 4",Adaptable; Tolerates alkaline; Tolerates dry,A yellow branched sport of Andorra Youngstown. Tolerates heat.1981,Lime Ricky Coral Bells,Heuchera,17 in,15 in,Clump;      Mound,Early summer;      Late summer;      Mid-summer,Lime-green foliage,White, , ,"3, 4, 5, 6, 7, 8, 9", , 440,Limelight Hydrangea,Hydrangea paniculata,8 ft,5 ft,Upright, ,Large conical panicles of light green flowers emerge mid-late summer; blooms turn shades of pink and burgundy in fall. Leave dried flowers on plant for winter interest. Prune in winter/early spring.,Green; Pink,Border,Full sun; Part sun,"4, 5, 6, 7, 8",Adaptable; Prefers evenly-moist; Tolerates alkaline; Tolerates dry,2006 Gold Medal Plant Award. Proven Winner¬ ColorChoice¬ Program. Blooms on new wood.1240,Lincoln Elm,Ulmus rubra,50 ft,30 ft,Rounded, ,Horizonal branching, ,Shade tree; Street tree,Full sun,"4, 5, 6, 7",Adaptable,Cross between Siberian elm and red elm. Has apparent resistance to DED  but not widely tested. Shown defoliation by elm beetle. Hybrid selection from a cross between Siberian elm and red elm that has apparent resistance to DED but has not been widely tested. Used for street use but not under utility lines.238,Lincoln Star Clematis,Clematis,10 ft,3 ft,Climbing;     Twining,Summer;     Fall, ,Pink,Cutting;      Focal point;      Fragrance;      Screen,Full sun;      Part sun,"3, 4, 5, 6, 7, 8, 9",Prefers well-drained;     Prefers evenly-moist;     Prefers high organic matter,"Flowers are 6""  raspberry-pink with a deeper bar. Suitable as a cut flower."1776,Lipstick Alpine Strawberry,Fragaria x,6 in,12 in,Mound,Mid-summer; Late summer,Pink flowers that continually bloom all season followed by small bright red edible fruit.,Pink,Attract wildlife; Border; Edible landscape; Fruit,Full sun,"2, 3, 4, 5, 6, 7",Adaptable,Spreads by stolons.631,Liset Crabapple,Malus,20 ft,15 ft,Rounded,Fall;      Spring;      Summer,Spring bright red flowers followed by maroon fruits which persist through fall; purple-bronze foliage all season, ,Attract wildlife;      Boulevard planting;      Pollinator garden,Full sun,"4, 5, 6, 7",Prefers acidic;      Prefers well-drained,Well-proportioned  small tree for small garden areas. Good for pollinators. Blooms on old wood.2086,Little Aurora Hosta,Hosta,10 in,20 in,Mound,Early summer;      Late summer;      Mid-summer,Small leaves are golden with pale lavender to white flowers,Lavender;  White,Border;      Boulevard planting,Part sun,"3, 4, 5, 6, 7, 8, 9", , 2630,Little Bluestem,Schizachyrium scoparium,36 in,48 in,Clump; Upright,Late summer; Early fall,Blue-gray foliage turning red in fall. After frost;  leaves turn a rich orange-wheat color. Seedheads are tan.,Gold,Border; Erosion control; Foundation planting; Native; Natural planting; Prairie planting; Xeriscaping,Full sun; Part sun,"3, 4, 5, 6, 7, 8, 9, 10",Tolerates dry,Native prairie grass. Blue color present at its base. Upright foliage. Clump forming.1692,Little Boy Blue Pink,Dianthus x,15 in,15 in,Mound,Late spring;      Early summer,Flowers are white with pink centers,White;  Pink,Border;      Rock garden,Full sun,"3, 4, 5, 6, 7, 8",Tolerates alkaline;      Prefers well-drained, 1199,Little Giant Arborvitae,Thuja occidentalis,3 ft,3 ft,Globe,Fall;      Spring;      Summer;      Winter;      Year-round,Evergreen foliage all year, ,Foundation planting,Full sun;      Part sun,"4, 5, 6, 7, 8",Prefers well-drained, 1729,Little Giant Coneflower,Echinacea purpurea,24 in,18 in,Upright,Early summer;      Late summer;      Mid-summer,Wide red/reddish-purple double flowers,Pink;  Red,Border;      Cutting;      Natural planting;      Pollinator garden;     Butterfly garden,Full sun;      Part sun,"3, 4, 5, 6, 7, 8", ,Good for pollinators. Nectar source for adult monarchs.1867,Little Grapette Daylily,Hemerocallis,12 in,8 in,Upright;     Mound,Early summer,2 1/2-inch light grape-purple flowers,Purple,Border;      Boulevard planting,Full sun;      Part sun,"3, 4, 5, 6, 7, 8",Prefers evenly-moist,Deadhead frequently to promote repeat flowering.  Divide in Late summer or fall.1756,Little Joe Pye Weed,Eupatorium purpureum,48 in,18 in,Upright,Early fall;      Late summer, ,Mauve,Border;      Natural planting;      Pollinator garden;     Butterfly garden,Full sun;      Part sun,"3, 4, 5, 6, 7, 8", ,Good for pollinators.  Nectar source for adult monarchs.138,Little King river birch,Betula nigra,10 ft,12 ft,Oval; Upright, ,Green toothed foliage turns yellow in the fall. Exfoliating red and pink bark is exposed in the winter after leaves fall., ,Border; Natural planting; Riparian planting,Full sun; Part shade,"4, 5, 6, 7, 8, 9",Adaptable; Prefers acidic; Prefers evenly-moist; Tolerates clay; Tolerates dry; Tolerates sandy soil,Best planted in low area along streams and ponds. Very adaptable tree: tolerates heat; tolerates dry437,Little Lamb Hydrangea,Hydrangea paniculata,7 ft,8 ft,Upright, ,Conical panicles of pure white flowers emerge in late summer. Plant blooms into fall;  with flowers taking on a pink hue late in the year. Dried flowers remain on plant through winter bringing a unique touch to winter landscapes.,Pink; White,Border,Full sun; Part sun,"3, 4, 5, 6, 7, 8",Adaptable; Prefers evenly-moist; Prefers loam; Tolerates alkaline; Tolerates dry,Hybridized by Jelena DeBelder of Belgium. Proven Winner¬ ColorChoice¬ Program. Blooms on new wood.2207,Little Lantern Ligularia,Ligularia,20 in,24 in,Mound,Mid-summer;     Late summer,Conical spikes of open yellow daisy flowers.,Yellow, ,Full sun;     Part sun,"4, 5, 6, 7, 8, 9", ,A stocky dwarf cultivar with conical spikes of open yellow daisy flowers. Dark green kidney shaped leaves with purple stems.981,Little Mischief Garden Path,Rosa,3 ft,3 ft,Rounded,Summer,Deep-pink with a white eye fade to lighter pink with age. Glossy green foliage.,Pink,Border;      Container;      Hedge;      Pollinator garden,Full sun,"4, 5, 6, 7, 8, 9",Prefers well-drained;     Prefers evenly-moist;     Prefers high organic matter,Own root. Plant in protected location  provide winter protection and wait to cut back until spring. Good for pollinators.1083,Little Princess Spirea,Spiraea japonica,2.5 ft,3 ft,Rounded, ,Summer pink flowers; dark red fall color,Pink,Border; Pollinator garden,Full sun; Part sun,"4, 5, 6, 7, 8", ,Similar to Daphne Spirea. Good for pollinators.2208,Little Rocket Ligularia,Ligularia,20 in,24 in,Mound,Mid-summer; Late summer,Conical spikes of yellow flowers emerge on long stalks mid summer. Heart-shaped green leaves form an attractive mound all growing season.,Yellow, ,Full sun; Part sun,"4, 5, 6, 7, 8, 9", ,A dwarf cultivar with large bright yellow conical flower heads atop long-stemmed heart-shaped green leaves. Prefers partial shade and cool moist locations.2437,Little Spire Russian Sage,Perovskia,24 in,24 in,Upright;     Open;     Clump,Late summer,Silvery foliage and lavender-blue flowers,Lavender, ,Full sun,"4, 5, 6, 7, 8, 9", ,Introduction by FuturePlants in the Netherlands. Selected for its dwarf  upright habit. Doesn't flop or lean. Blooms late summer through autumn.2323,Little Titch Catmint,Nepeta racemosa,10 in,15 in,Mound,Early summer;      Late summer;      Mid-summer,Sweetly scented grey green foliage., ,Border;      Boulevard planting;      Pollinator garden,Full sun;      Part sun,"4, 5, 6, 7, 8", ,The smallest nepeta yet. Discovered at Four Seasons Perennials in Great Britain. Good for pollinators.1868,Little Wine Cups Daylily,Hemerocallis,15 in,12 in,Upright;     Mound,Early summer,Flowers are cherry red with yellow throats,Red,Border;      Boulevard planting,Full sun;      Part sun,"3, 4, 5, 6, 7, 8",Adaptable,Divide in Late summer or fall.1218,Littleleaf Linden,Tilia cordata,45 ft,40 ft,Pyramidal, ,Summer yellow/white flowers;  fragrant foliage; fall yellow-green foliage, ,Pollinator garden; Shade tree; Street tree,Full sun,"4, 5, 6, 7",Adaptable; Prefers evenly-moist; Tolerates alkaline,Great street and residential tree. Good for pollinators.2622,Lizard's Tail,Saurus cernuus,24 in,24 in,Clump;     Upright,Early fall;     Early summer;     Late summer;     Mid-summer,Unique fragrant flowers and seedheads,White,Natural planting;     Raingarden;     Water garden,Full sun;     Part sun,"3, 4, 5, 6, 7, 8, 9", ,Showy flowers. Fragrant flowers and leaves. Will naturalize if allowed. Recommend planting in submerged basket in water gardens.2235,Lobelia,Lobelia erinus compacta,6 in,12 in,Mound,Early summer;     Late summer;     Mid-summer,Delicate flowers when summer temperatures are cool,Blue;  Purple;  White,Border;     Container;     Pollinator garden,Full sun;     Part sun,Annual,Prefers evenly-moist,If plants become leggy or overgrown shear back for new growth. Series: Laguna Riviera. Good for pollinators.525,Lodense Privet,Ligustrum vulgare,5 ft,5 ft,Rounded,Early summer;      Late summer;      Mid-summer,June white flowers. Winter injury likely.,White,Hedge,Full sun,"4, 5, 6, 7, 8",Adaptable, 623,Lollipop¬ Crabapple,Malus,10 ft,10 ft,Rounded,Fall;      Spring,Prolific white flowers in spring followed by small yellow fruit in autumn.,White,Attract wildlife;      Boulevard planting;      Pollinator garden,Full sun,"4, 5, 6, 7",Prefers acidic;      Prefers well-drained,Introduced by Lake County Nursery. Excellent choice for formal gardens and courtyards. Good for pollinators. Blooms on old wood.775,Lombardy Poplar,Populus nigra,60 ft,10 ft,Columnar;     Upright,Fall,Fall yellow foliage, ,Screen;      Windbreak,Full sun,"3, 4, 5, 6",Prefers evenly-moist,Short lived plant. Shallow and aggressive roots. Do not plant near pavement where shallow roots can cause damage. Not good for street use or under utility lines.788,Longacre Potentilla,Potentilla fruticosa,3 ft,4 ft,Rounded, ,Yellow flowers begin blooming late spring and persist into fall.,Yellow,Border; Foundation planting; Pollinator garden,Full sun,"2, 3, 4, 5, 6, 7",Adaptable; Tolerates alkaline; Tolerates dry; Tolerates pollution,Good for pollinators. Blooms on old and new wood.2372,Longfellow Peony,Paeonia,36 in,30 in,Rounded,Early summer,Large;  double flowers with yellow stamens visible near the center. Strong stems. Semi-dwarf height.,Red, ,Full sun,"3, 4, 5, 6, 7",Prefers evenly-moist,Large double bright crimson flowers with yellow stamens visible near the center. Strong stems. Semi-dwarf height.2439,Longin Russian Sage,Perovskia,36 in,30 in,Upright;     Open;     Clump,Late summer;      Mid-summer,Small gray-green leaves with purple-blue flowers on upright panicles.,Blue;  Purple,Border;      Cutting;      Pollinator garden,Full sun,"4, 5, 6, 7, 8",Adaptable, 1069,Longwood Sunset Mountainash,Sorbus rufo-ferruginea,30 ft,30 ft,Rounded,Fall,Fall burgundy foliage;  orange berries, ,Attract wildlife;      Street tree,Full sun,"4, 5, 6, 7",Prefers acidic;      Prefers well-drained, 1542,Looking Glass Siberian Bugloss,Brunnera macrophylla,15 in,24 in,Mound,Late spring; Early summer,Silver heart-shaped foliage with green veination. Clusters of tiny blue flowers bloom above foliage in spring.,Blue,Border; Natural planting,Full shade; Part shade; Part sun,"3, 4, 5, 6, 7, 8",Adaptable; Prefers evenly-moist; Tolerates dry,A sport of 'Jack Frost'; foliage is almost solid silver with green veination. Spring flowers resemble forget-me-nots. Can be planted under trees; will tolerate dry1858,Loraine Sunshine Sunflower,Heliopsis,30 in,24 in,Upright,Early summer;      Late summer;      Mid-summer,Variegated green/cream leaves and golden yellow flowers,Gold;  Yellow,Border;      Prairie planting;     Pollinator garden;     Butterfly garden,Full sun;      Part sun,"3, 4, 5, 6, 7, 8, 9", ,Nectar source for adult monarchs.2378,Lotus Queen Peony,Paeonia,30 in,30 in,Rounded,Late spring,Blooms are white outside with sulfur yellow inside,White;  Yellow,Border,Full sun,"4, 5, 6, 7",Prefers loam, 614,Louisa Crabapple,Malus,15 ft,15 ft,Weeping, ,Large pink flowers emerge in spring. Golden yellow fruit forms in fall and blushes slightly in cold weather. Fruit persists on tree through winter.,Pink,Attract wildlife; Boulevard planting; Pollinator garden,Full sun,"4, 5, 6, 7",Prefers acidic; Prefers well-drained,Unique weeping form. Good for pollinators. Blooms on old wood.282,Louise Rowe Clematis,Clematis,8 ft,3 ft,Climbing;     Twining,Summer;     Fall, , ,Focal point;      Fragrance;      Screen,Full sun;      Part sun,"4, 5, 6, 7, 8, 9",Prefers well-drained;     Prefers evenly-moist;     Prefers high organic matter,Pale blue 5-6' flowers fade to white. Produced semi-double and single blossoms.1749,Love Grass,Eragrostis elliotii,36 in,36 in,Upright,Early summer;     Late summer;     Mid-summer,Narrow bluish-green foliage with airy seedheads, , ,Full sun,Annual, , 2018,Love Pat Hosta,Hosta,20 in,36 in,Mound,Early summer,Rounded;  cupped;  textured blue-green leaves,White,Border;      Boulevard planting,Part sun,"3, 4, 5, 6, 7, 8",Prefers evenly-moist,Tokudama-type; foliage is blue thick cupped and crinkly.  Very slug resistant. Will retain blue color best in full shade. Flowers in mid-summer.1373,Love-lies-bleeding,Amaranthus caudatus,24-48 in,24 in,Trailing; Weeping,Early summer; Mid-summer; Late summer,Most varieties grown for red;  yellow;  green;  and gold leaves. Some also have rusty-red;  drooping;  tassel flowers.,Red,Border; Container; Drying,Full sun,Annual,Adaptable; Prefers dry; Tolerates poor,Foliage and flower colors are more brilliant in poor2087,Loyalist Hosta,Hosta,18 in,24 in,Mound,Early summer;      Late summer;      Mid-summer,Leaves have deep green margins and pure white centers; lavender flowers,Lavender,Border;      Boulevard planting,Part sun,"3, 4, 5, 6, 7, 8, 9", , 1142,Ludwig Spaeth Lilac,Syringa vulgaris,12 ft,8 ft,Upright, ,Single reddish-purple fragrant spring flowers.,Purple,Border; Pollinator garden,Full sun,"3, 4, 5, 6, 7",Prefers well-drained; Tolerates alkaline,Developed in 1883. One of the best purple lilacs available. Good for pollinators.857,Luscious Pear,Pyrus,20 ft,15 ft, , ,Juicy;  sweet;  medium to small bright yellow fruit. Glossy green foliage;  red fall color.,White,Edible landscape; Fruit; Pollinator garden,Full sun,"4, 5, 6, 7, 8", ,SDSU introduction 1973 (South Dakota E31 x Ewart).  Pollen-sterile - can not be used to pollinate a second pear tree. Parker is a good pollinator.1696,Luxuriant Bleeding Heart,Dicentra,15 in,18 in,Clump,Early summer;      Late spring;      Late summer,Fern-like lacy foliage,Pink;  Red,Border,Part sun,"4, 5, 6, 7, 8",Prefers evenly-moist, 398,Maacki Burning Bush,Euonymus hamiltonianus var. maacki,15 ft,15 ft,Rounded,Fall;      Summer,Pink fruits and red seeds in late summer., ,Border,Full sun;      Part sun,"3, 4, 5, 6", , 659,Macho Amur Corktree,Phellodendron amurense,60 ft,40 ft,Rounded,Fall;      Winter,Fall yellow foliage; winter interesting;  furrowed bark, ,Shade tree,Full sun,"4, 5",Tolerates alkaline;      Tolerates dry,A male selection with ascending branches without fruit and subsequent volunteer seedlings. Requires frequent pruning when young to remove branches with included bark. Restrict use to the Hardwood Hills because of cold hardiness. Used for street use but not under utility lines.753,Macopin Eastern White Pine,Pinus strobus,3 ft,3 ft,Upright,Summer;     Spring;     Winter,Dwarf selection. Soft blue-green feathery needles., , ,Full sun,"3, 4, 5, 6, 7, 8", ,Blue-green silvery soft needles. Light brown cones.563,Macoun Apple,Malus,14 ft,10 ft, ,Spring; Fall,Aromatic;  medium sized;  dark purple-red fruit with white flesh. Crisp texture;  well-balanced flavor - good for eating.,White,Edible landscape; Fruit; Pollinator garden,Full sun,"4, 5, 6, 7",Prefers acidic; Prefers well-drained,(McIntosh x Jersey Black) New York  1923.  Fruit tends to drop when ripe. Good for pollinators. Blooms on old wood.292,Macropetala Clematis,Clematis macropetala,12 ft,3 ft,Climbing;     Twining,Spring, ,Lilac, ,Full sun;      Part sun,"4, 5, 6, 7, 8, 9",Prefers well-drained;     Prefers evenly-moist;     Prefers high organic matter,"Flowers are 2""  blue lantern-like  free flowering  attractive seed heads."311,Madame Julia Correvon Clematis,Clematis viticella,14 ft,3 ft,Climbing;     Twining,Summer;     Fall, ,Red,Focal point;      Fragrance;      Screen,Full sun;      Part sun,"2, 3, 4, 5, 6, 7, 8, 9",Prefers well-drained;     Prefers evenly-moist;     Prefers high organic matter,"Flowers are true red  semi-campanulate  4"". Vigorous grower  flowering most of the summer."1057,Madonna Elder,Sambucus nigra,10 ft,10 ft,Rounded;      Upright,Summer,Variegated yellow and green foliage; large 6-10 inch white flowers in spring,White,Border;      Natural planting;      Pollinator garden,Full sun;      Part sun,"4, 5, 6, 7", ,Good for pollinators.601,Madonna¬ Crabapple,Malus,20 ft,10 ft,Compact; Upright, ,Spring large fragrant double white flowers followed by gold to red fruit; new foliage is bronze turning green at maturity.,White,Boulevard planting; Pollinator garden; Street tree,Full sun,"4, 5, 6, 7",Prefers acidic; Prefers well-drained,Compact form; good choice for streets or urban landscapes. Blooms early and flowers last longer than many other varieties. Good for pollinators. Blooms on old wood.1118,Magic Berry Coralberry,Symphoricarpos xdoorenbosii,5 ft,5 ft,Rounded, ,Masses of pink berries in fall,White,Foundation planting; Natural planting; Pollinator garden,Full sun; Part sun,"4, 5, 6, 7, 8, 9", ,Good for pollinators.2483,Magic Blue Phlox,Phlox paniculata,42 in,24 in,Upright,Early summer; Mid-summer; Late summer,Flowers open solid lavender pink with light eye;  then mature to pale petals with darker eye,Lavender; Pink,Border; Butterfly garden; Fragrance; Pollinator garden,Full sun,"4, 5, 6, 7, 8, 9", ,Nectar source for adult butterflies.1080,Magic Carpet Spirea,Spiraea japonica,1.5 ft,2 ft,Rounded,Summer,Red spring shoots become bronze red-tipped foliage; deep pink flowers in summer,Pink,Border;      Pollinator garden,Full sun,"3, 4, 5, 6, 7, 8", ,2000 Michigan Growers  Choice Award Winner. Good for pollinators.1660,Magic Fountains Delphinium,Delphinium,36 in,30 in,Upright,Late summer;      Mid-summer, ,Blue;  Lavender;  Red;  White,Border;      Cutting;      Pollinator garden,Full sun,"3, 4, 5, 6, 7, 8",Prefers evenly-moist,Series: Magic Fountains. Good for pollinators.2336,Magical Michael Basil,Ocimum basilicum,18 in,12 in,Upright,Early summer;     Late summer;     Mid-summer,More decoration than culinary.,White,Edible landscape;     Pollinator garden,Full sun,Annual, ,Use flowers as garnishes and salads and leaves for pesto and sauces. Fragrant and drying. Good for pollinators.960,Magnifica Rose,Rosa rugosa,6 ft,6 ft,Rounded,Summer,Fragrant double flowers - repeated bloomer, ,Border;      Foundation planting;      Fragrance;      Pollinator garden,Full sun,"4, 5, 6, 7",Prefers well-drained;     Prefers evenly-moist;     Prefers high organic matter,Own root. (aka Rugosa Magnifica) Hybridized by Van Fleet; Year of Registration or Introduction: 1905. Good for pollinators.1724,Magnus Purple Coneflower,Echinacea purpurea,36 in,18 in,Clump;      Upright,Late summer, ,Pink;  Purple,Border;      Cutting;      Natural planting;      Pollinator garden;     Butterfly garden,Full sun,"3, 4, 5, 6, 7, 8, 9",Adaptable,Divide every 4 years; self-seeds. Good for pollinators. Nectar source for adult monarchs.