umn_plantID,common_name,scientific_name,height,spread,form,seasonal_interest,seasonal_interest_specific,flower_color,landscape_use,light,zone,soil,notes1504,Ruby Wedding Masterwort,Astrantia major,22 in,15 in,Mound,Early summer;      Mid-summer;      Late summer;      Early fall,strawberry shaped buds open to starry papery pin-cushion like dark red flowers - green palmately divided foliage,Red, ,Part shade;      Full shade,"4, 5, 6, 7, 8",Prefers high organic matter;     Prefers evenly-moist;     Prefers loam,A long blooming perennial - is a good cut flower and the flowers dry beautifully.36,Rubyfrost  Maple,Acer rubrum,50 ft,50 ft,Oval;      Upright,Fall,Ruby red fall color.,Red,Pollinator garden;      Shade tree,Full sun,"3, 4, 5, 6, 7",Tolerates dry,A Chicagoland Grows¬ selection; superior cold hardiness; uniform growth habit; excellent drought tolerance. Excellent choice for northern areas. Good for pollinators.1386,Rue Anemone,Anemonella thalictroides,12 in,12 in,Upright;     Mound;     Clump,Early spring;     ;     Mid-spring,Single white flowers in early spring,White,Natural planting;      Rock garden,Part sun,"4, 5, 6, 7, 8",Prefers evenly-moist;      Tolerates acidic,Long-blooming spring woodland flower; delicate white flowers often with a pink tinge each on its own dark colored stem. Important for it to be sheltered from the wind.1878,Ruffled Apricot Daylily,Hemerocallis,30 in,18 in,Upright;     Mound,Early summer;      Mid-summer, ,Orange,Border;      Boulevard planting,Full sun;      Part sun,"3, 4, 5, 6, 7, 8, 9",Adaptable,Divide in Late summer or fall.2166,Ruffled Velvet Siberian Iris,Iris sibirica,24 in,14 in,Upright,Early summer,Velvety violet flowers,Purple,Border,Full sun;      Part sun,"3, 4, 5, 6, 7, 8",Prefers evenly-moist;      Tolerates wet, 1012,Rugosa Rose,Rosa rugosa,6 ft,6 ft,Rounded,Summer;     Fall;     Winter,Deep rose-pink fragrant blooms in June; fall orange red hips and yellow to orange foliage,Mauve,Border;      Foundation planting;      Fragrance;      Pollinator garden,Full sun,"2, 3, 4, 5, 6, 7",Adaptable,Spreads by suckers; The pointed buds of this rugged  rose open to flowers of a heady  spicy perfume. Propagated from seed  the blooms may vary from pale pink and deep rose to nearly crimson  with an occasional white for good measure. The disease resistant foliage is deeply veined  enhanced by brilliant fall color and bright red hips. Own root. Good for pollinators.1301,Rumba Weigela,Weigela florida,3 ft,3 ft,Rounded,Summer,Bronzy-purplish foliage and dark red flowers, ,Border,Full sun,"4, 5, 6, 7, 8", ,Developed at the Ottawa Experiment Station in Canada. Flowers from June to September.96,Running serviceberry,Amelanchier stolonifera,6 ft,6 ft,Upright, ,Yellow-orange to red fall color;  dark purple fruit ripens in June.,White,Border; Edible landscape; Foundation planting; Fruit; Hedge; Pollinator garden,Full sun; Part sun,"4, 5, 6, 7, 8", ,Good for pollinators. Blooms on old wood. Prune after blooming.1209,Rushmore Arborvitae,Thuja occidentalis,25 ft,6 ft,Columnar; Pyramidal; Upright, , , ,Backdrop; Border; Hedge; Screen,Full sun; Part sun,"3, 4", ,Tolerates wind and cold temperatures2247,Russell Hybrid Lupine,Lupinus,48 in,36 in,Upright,Early summer,Available in many colors including bicolors,Mixed,Border;      Cutting,Full sun;      Part sun,"4, 5, 6, 7, 8, 9",Prefers evenly-moist;      Prefers well-drained,Legume (fixes atmospheric nitrogen)1061,Russet Buffalo berry,Shepherdia canadensis,13 ft,8 ft,Rounded; Upright, ,Dioecious. Red fruit in fall. Orange-dotted bark gives rusty appearance, ,Attract wildlife; Backdrop; Native; Natural planting; Pollinator garden; Screen,Full sun; Part sun,"2, 3, 4, 5, 6, 7, 8, 9, 10, 11",Prefers well-drained,Extreme cold tolerance. Alternate name: soapberry651,Russian Cypress,Microbiota decussata,1 ft,4 ft,Spreading,Fall;      Spring;      Summer;      Winter;      Year-round,Foliage resembles Arborvitae - bright green in summer - bronze in winter, ,Foundation planting,Full sun;      Part sun,"2, 3, 4, 5, 6", ,Hardy to -40 degrees F. Found in the wild near Vladivostok  E. Siberia. 1998 Cary Award Winner. Protect from winter winds and salt. Other names: Russian carpet cypress.365,Russian Hawthorn,Crataegus ambigua,15 ft,18 ft,Upright;     Spreading,Fall;      Spring;      Summer,Spring purple/pink flowers; bright fruits persist through fall.,Pink;  Purple, ,Full sun;      Part sun,"4, 5, 6, 7", ,Small tree with irregular branching pattern. Exhibits good resistance to cedar apple rust.1361,Russian Hollyhock,Alcea rugosa,72 in,24 in,Upright;     Narrow,Early summer;      Mid-summer;      Late summer,Large single soft yellow flowers,Yellow,Border,Full sun,"2, 3, 4, 5, 6, 7, 8",Prefers evenly-moist;      Prefers well-drained, 653,Russian Mulberry,Morus alba tatarica,45 ft,45 ft,Rounded,Summer,Unusual foliage and red summer fruits; glossy green foliage; wildlife food, ,Attract wildlife;      Shade tree;      Street tree,Full sun;      Part sun,"4, 5, 6, 7, 8",Prefers evenly-moist,Hardiness variable; injury common; wildlife food166,Russian Peashrub,Caragana frutex,8 ft,8 ft,Upright,Spring,Spring showy yellow flowers.,Yellow,Hedge;      Screen;      Windbreak;      Xeriscaping,Full sun,"2, 3, 4, 5, 6, 7",Adaptable;      Tolerates dry,Similar to Siberian Peashrub but bushier  shorter  darker foliage. Good for tough sites. Nitrogen fixing. Blooms on old wood.2440,Russian Sage,Perovskia atriplicifolia,48 in,60 in,Spreading;     Open;     Clump,Late summer,Semi-woody plant. Silvery gray foliage with light blue - lavendar flowers. Fragrant folaige.,Blue,Border;      Boulevard planting;      Cutting;      Fragrance;      Pollinator garden,Full sun,"4, 5, 6, 7, 8, 9",Adaptable;      Prefers well-drained,Foliage is aromatic.  Requires very well-drained soil. Perennial Plant of the Year for 1995. Good for pollinators.2030,Sagae Hosta,Hosta,20 in,26 in,Mound,Mid-summer,Slightly wavy green leaves with irregular yellow margin.,Lavender,Border;      Boulevard planting,Part sun,"3, 4, 5, 6, 7, 8",Prefers evenly-moist, 2059,Sagae Hosta,Hosta,20 in,26 in,Mound,Mid-summer,Slightly wavy green leaves with irregular yellow margin.,Lavender,Border;     Boulevard planting,Part sun,"3, 4, 5, 6, 7, 8",Prefers evenly-moist, 2103,Saint Elmo's Fire Hosta,Hosta,16 in,30 in,Mound,Early summer;      Late summer;      Mid-summer,Spring leaves are golden yellow with white margin and red petioles;  turning darker green later in the season,Lavender,Border,Part sun,"3, 4, 5, 6, 7, 8, 9", , 540,Sakhalin Honeysuckle,Lonicera sachalinensis maximowiczii,10 ft,10 ft,Rounded,Fall;      Summer,Summer dark purple flowers; fall red fruit;  yellow foliage.,Purple,Border;      Foundation planting,Full sun;      Part sun,"4, 5, 6, 7", ,Excellent foliage. Blooms on old wood.2595,Salvia,Salvia farinacea,18 in,10 in,Upright,Early summer;     Late summer;     Mid-summer,Spikes of blue flowers above plants,Blue;  Purple,Border;     Container;     Drying;     Pollinator garden,Full sun,Annual, ,Fertilize heavily for best performance.  Pinch young transplants for bushy plants. Good for pollinators.1288,Samba Weigela,Weigela florida,3 ft,3 ft,Rounded,Fall;      Spring;      Summer,Green leaves tinged w purple,Pink,Foundation planting,Full sun;      Part sun,"4, 5, 6, 7, 8", ,Numerous small dark pink to purple flowers with yellow throats in May and June. The new growth is tinged copper.1559,Samobor Geranium,Geranium phaeum,24 in,24 in,Mound,Spring;      Summer,Dark purple nodding flowers with green heavily lobed foliage with brown areas form a loose mound.,Purple,Pollinator garden,Full sun;      Part sun,"3, 4, 5, 6, 7, 8", ,Good for pollinators.1818,Samurai Hosta,Hosta,20 in,36 in,Upright,Mid-summer,Creamy yellow margined blue gree foliage,Lavender,Border;      Boulevard planting,Part sun,"4, 5, 6, 7, 8", ,Paul Aden cultivar - yellow-margined selection of H. sieboldiana - less susceptible to margin burn837,Sand Cherry,Prunus pumila,10 ft,6 ft,Upright,Spring; Summer,White flowers emerge along stems in spring. Burgundy-bronze green summer foliage. Dark purple summer fruit.,Pink,Attract wildlife; Edible landscape; Fruit; Native; Natural planting; Pollinator garden; Screen,Full sun; Part sun,"3, 4, 5, 6, 7", ,Good for pollinators. Fruit is sweet2029,Santa Cruz Majoram,Origanum,12 in,12 in,Mound,Late spring; Early summer; Mid-summer; Late summer,Ornamental. Wiry stems dcroop slightly under the weight of flowers,Cream,Drying; Fragrance; Pollinator garden,Full sun,"4, 5, 6, 7, 8, 9", , 825,Sapalta Cherry Plum,Prunus besseyi x P. Salicina,8 ft,6 ft,Rounded, ,Fruit is red-purple with almost black flesh and 1.25 in diam. Stone is almost free.,White,Attract wildlife;  Edible landscape;  Fruit;  Pollinator garden,Full sun,"3, 4, 5, 6, 7, 8", ,Purple - Canadian introduction  1941. Open-pollinated seedling of Sapa. Good for pollinators.2349,Sapphire Aster,Symphyotrichum dumosum var. strictior,15 in,12 in,Mound,Early fall;      Late summer, , ,Boulevard planting;     Butterfly garden;     Natural planting;     Pollinator garden;     Border,Full sun,"4, 5, 6, 7, 8",Prefers well-drained, 1449,Sapphire Blue Oat Grass,Helictotrichon sempervirens,30 in,18 in,Mound,Early summer; Mid-summer; Late summer,Silver blue foliage with flat oat-like panicles emerging light blue turning to golden-brown in fall.,Cream,Attract wildlife; Border; Lawn alternative; Natural planting; Xeriscaping,Full sun; Part sun,"4, 5, 6, 7, 8",Prefers well-drained,Requires full sun and excellent drainage.1855,Sarah Bernhardt Peony,Paeonia,36 in,36 in,Rounded,Late spring,Double large pink flowers with lighter tips to petals; fragrant,Pink,Border,Full sun,"3, 4, 5, 6, 7",Prefers loam,Late bloomer. A classic favorite.1155,Sarah Sands Lilac,Syringa vulgaris,10 ft,12 ft,Upright, ,Single violet-purple fragrant spring flowers,Magenta,Border; Pollinator garden,Full sun,"3, 4, 5, 6, 7",Prefers well-drained; Tolerates alkaline,Distinctive color. Good for pollinators.2377,Sarastro Bellflower,Campanula,18 in,15 in,Mound;      Upright,Early summer;      Late summer;      Mid-summer,Grape-purple flowers dangle on stems and re-blooms during season.,Purple,Border,Full sun;      Part sun,"3, 4, 5, 6, 7, 8", , 645,Sargent Crabapple,Malus sargentii,8 ft,12 ft, ,Fall;      Spring,Attractive lobed;  dark green foliage. Flower buds are pink and open to fragrant white blossoms. Small bright red fruit.,White,Attract wildlife;      Fragrance;      Pollinator garden,Full sun,"4, 5, 6, 7",Prefers acidic;      Prefers well-drained,Dwarf spreading form. The small bright red fruits are favored by birds. Good for pollinators. Blooms on old wood.1274,Sargent Cranberrybush,Viburnum sargentii,12 ft,12 ft,Rounded, ,May-June white flowers. Fall yellow-red foliage. Scarlet fruit, ,Attract wildlife; Border,Full sun; Part sun,"3, 4, 5, 6, 7",Prefers evenly-moist; Tolerates alkaline,Prefers cool sites.477,Sargent Green Juniper,Juniperus chinensis var. sargentii,2 ft,6 ft,Mound,Spring; Summer; Fall; Winter; Year-round,Evergreen foliage., ,Foundation planting,Full sun; Part sun,"4, 5, 6, 7",Adaptable; Prefers well-drained; Tolerates alkaline; Tolerates dry, 1233,Sargent Hemlock,Tsuga Canadensis,15 ft,30 ft,Weeping,Spring;      Summer;      Fall;      Winter;      Year-round,Horizonally spreading branches, , ,Part sun;      Part shade;      Full shade,"3, 4, 5, 6, 7",Prefers evenly-moist;      Prefers well-drained;      Prefers acidic,A broad  full evergreen with weeping branches. Protect from winter winds.777,Sargent Poplar,Populus sargentii,85 ft,40 ft,Upright,Fall,Fall yellow foliage, ,Street tree,Full sun,"3, 4, 5, 6",Adaptable;      Prefers evenly-moist, 494,Savin Juniper,Juniperus sabina,1 ft,5 ft,Compact; Upright, ,Dark green foliage year-round., ,Foundation planting,Full sun,"3, 4, 5, 6, 7",Tolerates alkaline; Tolerates sandy soil,Excellent choice for the foundation planting. Tolerates windy493,Scandia Juniper,Juniperus sabina,2 ft,5 ft,Spreading,Fall;      Spring;      Summer;      Winter;      Year-round,Bright green evergreen foliage all year., ,Foundation planting,Full sun,"3, 4, 5, 6, 7",Adaptable, 1561,Scarlet Flame Phlox,Phlox subulata,6 in,18 in,Creeping; Mound,Late spring; Early summer,Tiny pink flowers bloom across a carpet of dense foliage in spring. Green spring foliage holds color year round.,Pink,Border; Pollinator garden; Rock garden,Full sun,"4, 5, 6, 7, 8", ,Dense foliage forms carpet over ground43,Scarlet Jewell  Maple,Acer rubrum,70 ft,40 ft,Oval;      Upright,Fall;      Spring;      Summer,Dark green summer foliage; deep crimson fall foliage color two weeks earlier than other rubrum Maples. Red flowers in spring.,Red,Pollinator garden;      Shade tree,Full sun,"3, 4, 5, 6, 7",Prefers acidic;      Prefers evenly-moist,Selected in Northern Minnesota by Terry Schwartz of Bailey Nurseries. A full  upright Maple. Symmetrical branching and resistance to frost cracking. Good for pollinators.1002,Scarlet Meidiland¬ Rose,Rosa,4 ft,6 ft,Climbing;     Cascading,Summer,Clusters of small red flowers. flower clusters,Red,Border;      Foundation planting;      Pollinator garden;     Ground cover,Full sun;     Part shade,"4, 5, 6, 7, 8, 9",Prefers well-drained;     Prefers evenly-moist;     Prefers high organic matter,Possibly the most vigorous of the Meidiland roses though does die back to crown.  This rose will spread up up to 6 feet and conquer the most difficult of circumstances. The rich  disease resistant foliage backs a blanket of vivid scarlet clusters each composed of ten to fifteen flowers. The small ruffled blossoms are lightly fragrant and appear from June until frost. Own root. Good for pollinators.869,Scarlet Oak,Quercus coccinea,90 ft,60 ft,Pyramidal,Fall,Fall scarlet;  red foliage, ,Shade tree;      Street tree,Full sun,"4, 5, 6, 7",Prefers acidic;      Tolerates alkaline;      Tolerates dry;     Prefers well-drained,Similar to Pin Oak  but more rounded. Retains foliage through winter.2495,Scarlet O'Hara Oriental Poppy,Papaver orientalis,16 in,18 in,Upright;     Mound;     Clump,Late spring,Ruffled flowers have a small basal blotch,Red,Pollinator garden,Full sun,"2, 3, 4, 5, 6, 7, 8, 9", ,Short and compact with large flowers.2413,Scarlet O'Hara Peony,Paeonia x,36 in,30 in,Rounded,Late spring;      Mid-spring,Yellow stamen center,Red, ,Full sun,"3, 4, 5, 6, 7", ,Early. Large fiery red single flowers and rich green foliage. Tall vigorous plant habit.2397,Scarlet Runner Bean,Phaseolus coccineus,96 in,18 in,Climbing;     Twining,Early summer;     Late summer;     Mid-summer,"1"" scarlet red pea-like flowers in clusters;  followed by bean pods which are edible when young.",Red, ,Full sun,Annual, ,Provide support for twining vine2451,Scarlet Salvia,Salvia splendens,18 in,10 in,Upright,Early summer;     Late summer;     Mid-summer,Spikes of flowers in a variety of colors,Pink;  Purple;  Red;  White,Border;     Container;     Pollinator garden,Full sun;     Part sun,Annual,Prefers evenly-moist,Fertilize heavily for best performance.  Pinch young transplants for bushy plants. Series: Sizzler. Good for pollinators.2608,Scarlet Salvia,Salvia splendens,18 in,10 in,Upright,Early summer;     Late summer;     Mid-summer,Spikes of flowers in a variety of colors,Pink; Purple; Red; White,Border;     Container;     Pollinator garden,Full sun;     Part sun,Annual,Prefers evenly-moist,Fertilize heavily for best performance.  Pinch young transplants for bushy plants. Series: Sizzler. Good for pollinators.72,Scarlet Sentinel¬ Maple,Acer x freemanii,45 ft,25 ft,Columnar; Oval; Upright, ,Yellow/orange/red fall foliage., ,Street tree,Full sun,"4, 5, 6, 7",Prefers acidic,May be chlorotic on high pH soils. A fast growing Freemanii Maple hybrid that is more columnar and smaller in stature than other varieties.231,Scartho Gem Clematis,Clematis,8 ft,3 ft,Climbing;     Twining,Summer;     Fall, ,Pink,Focal point;      Fragrance;      Screen,Full sun;      Part sun,"2, 3, 4, 5, 6, 7, 8, 9",Prefers well-drained;     Prefers evenly-moist;     Prefers high organic matter, 2418,Scented Geraniums,Pelargonium species,20 in,20 in,Mound,Early summer;     Mid-summer;     Late summer,Scented leaves of various shapes and color; some varieties flower, ,Fragrance,Full sun;     Part sun,Annual,Prefers well-drained,Available scents include Rose (P. graveolens);  Lime (P. nervosum);  Peppermint (P. tomentosum);  Apple (P. odoratissimum);  Lemon (P. crispum) and Nutmeg (P. x fragrans)45,Schlesinger Maple,Acer rubrum,50 ft,45 ft,Oval; Upright, ,Red flower buds emerge early in spring. Green summer foliage turns red in fall., ,Pollinator garden; Shade tree; Street tree,Full sun; Part sun,"4, 5, 6, 7",Prefers acidic,Good for pollinators. Intensity of fall color is site dependent; will be chlorotic when grown in high pH soils.721,Schoodic Pine,Pinus banksiana,18 ft,6 ft,Prostrate;     Spreading,Spring;     Summer;     Fall;     Winter;     Year-round, , , ,Full sun,"2, 3, 4, 5, 6", ,A low growing  mat-forming selection of Jack Pine with bright green needles.1671,Schottland Tufted Hair Grass,Deschampsia cespitosa,42 in,24 in,Upright,Early fall;      Late summer;      Mid-summer,Large beige flowers above foliage,Gold,Border,Part sun;     Full shade,"4, 5, 6, 7, 8",Prefers evenly-moist,Difficult to establish in sun26,Schwedler Maple,Acer platanoides,50 ft,40 ft,Rounded, ,Red spring foliage turns green through summer and fades back to red in fall., ,Pollinator garden; Shade tree; Street tree,Full sun; Part sun,"4, 5, 6, 7",Prefers evenly-moist; Prefers well-drained,Tolerates urban areas. 761,Scotch Bonna Hindu Pan Pine,Pinus sylvestris,6 ft,5 ft,HinduPan;     Open;     Upright;     Spreading,Spring;     Summer;     Fall;     Winter;     Year-round,Silver-blue needles - cinnamon colored bark., , ,Full sun,"3, 4, 5, 6, 7", ,A selection of Scotch Pine from the Netherlands.  Trained into an oriental form.757,Scotch Hindu Pan Pine,Pinus sylvestris,12 ft,8 ft,HinduPan;     Columnar;     Open;     Upright;     Spreading,Spring;     Summer;     Fall;     Winter;     Year-round,Spreading branches - twisted blue-green needles, , ,Full sun,"3, 4, 5, 6, 7", ,trained into an oriental form.756,Scotch Pine,Pinus sylvestris,50 ft,30 ft,Pyramidal, ,Blue-green foliage all year; winter orange bark, ,Backdrop; Screen; Windbreak,Full sun,"3, 4, 5, 6, 7",Adaptable; Prefers well-drained; Tolerates dry; Tolerates sandy soil,Orange bark on branches. Short rigid twisted blue-green needles. Introduced.822,Scout Apricot,Prunus armeniaca mandschurica,15 ft,10 ft,Upright, ,Bronze gold fruit blushed with red. Better for canning and jam,White,Attract wildlife;  Edible landscape;  Fruit;  Pollinator garden,Full sun,"3, 4, 5, 6, 7, 8", ,Cultivar developed in Morden Manitoba 1937. Produces more fruit with a pollinator. Good for pollinators.426,Sea Buckthorn,Hippophae rhamnoides,20 ft,15 ft,Upright,Fall,Fall orange-yellow fruits not eaten by birds., ,Natural planting,Full sun,"3, 4, 5, 6, 7",Tolerates poor;      Tolerates salt,Both sexes needed for fruiting.1000,Sea Foam Rose,Rosa,3.5 ft,4 ft,Climbing;     Cascading,Summer,Clusters of white-pink flowers.,White,Border;      Foundation planting;      Pollinator garden,Full sun,"4, 5, 6, 7",Prefers well-drained;     Prefers evenly-moist;     Prefers high organic matter,Large clusters of slightly fragrant double blooms. Can grow as a Ground cover or climber. Foliage is lustrous dark green and disease resistant.Small red hips. Own root.468,Sea Green Globe Juniper,Juniperus chinensis,3 ft,3 ft,Globe,Spring; Summer; Fall; Winter; Year-round,Mint-green foliage darkens in cold weather., ,Foundation planting,Full sun,"4, 5, 6, 7, 8",Adaptable; Prefers evenly-moist; Prefers well-drained; Tolerates alkaline; Tolerates dry,Must be sheared to retain globe shape.467,Sea Green Juniper,Juniperus chinensis,5 ft,6 ft, ,Spring; Summer; Fall; Winter,Mint green foliage darkens in cold weather. Evergreen., ,Foundation planting,Full sun,"4, 5, 6, 7, 8",Adaptable; Prefers evenly-moist; Prefers well-drained; Tolerates alkaline; Tolerates dry,Very hardy. Tolerant of a wide variety of soils.2226,Sea Lavender,Limonium latifolium,30 in,18 in,Mound;     Clump,Mid-summer,Blue-Green foliage,Blue;  Lavender,Cutting;     Drying,Full sun,"3, 4, 5, 6, 7, 8, 9",Tolerates salt;     Tolerates dry;     Prefer well-drained,Seed can be successful collected and stored1595,Sea Oats,Chasmanthium latifolium,60 in,30 in,Clump,Fall;      Spring;      Summer,Green spring foliage turning copper in fall;  showy flat seedhead. May winter kill but self seeds. Other common names: Bamboo Grass.,Tan, ,Full sun;      Part sun,"4, 5, 6, 7, 8, 9, 10", , 2389,Sea Shell Peony,Paeonia lactiflora,36 in,30 in,Rounded,Early summer,Large pink flowers emerge in late spring-early summer.,Pink,Boulevard planting,Full sun,"3, 4, 5, 6, 7", ,Large859,Seckel Pear,Pyrus,12 ft,15 ft,Upright, ,Small russet colored fruit - sweet; spicy flavor suitable for cooking and canning.,White,Edible landscape;  Fruit;  Pollinator garden,Full sun,"4, 5, 6, 7, 8", ,Ripens in August or September in zones 4-5. Not a suitable pollinator for Bartlett. Bosc is a good pollinator. Self pollinating.2421,Seed Geraniums,Pelargonium x hortorum,15 in,12 in,Upright;     Mound,Early summer;     Mid-summer;     Late summer,Bright;  vivid flower colors.  Foliage is smoother than zonal geraniums.,Red;  White;  Pink;  Purple,Border;     Container,Full sun,Annual,Prefers evenly-moist, 603,Selkirk Crabapple,Malus,20 ft,30 ft,Rounded, ,Large purple-pink flowers emerge in spring. Red fruit forms in late summer/early fall. Glossy spring foliage is red and turns bronze-green in summer.,Pink; Purple,Boulevard planting; Pollinator garden,Full sun,"2, 3, 4, 5, 6, 7",Prefers acidic; Prefers well-drained,Introduced by the Morden Research Station. Hardy1164,Sensation Lilac,Syringa vulgaris,10 ft,12 ft,Upright, ,Single purple florets with a distinctive pure white borders. Fragrant spring flowers.,Purple,Border; Pollinator garden,Full sun,"3, 4, 5, 6, 7",Prefers well-drained; Tolerates alkaline,A mutation of  Hugo de Vries . Very unique. French Hybrid. Good for pollinators.2347,Sensitive Fern,Onoclea sensibilis,36 in,12 in,Upright,Early spring; Mid-spring; Late spring; Early summer; Mid-summer; Late summer,Deeply divided fronds - spore-bearing bodies on separate stem, ,Backdrop; Border; Foundation planting; Native; Natural planting; Shade garden; Woodland garden,Full shade; Part shade,"3, 4, 5, 6, 7, 8, 9",Prefers evenly-moist; Prefers high organic matter; Tolerates wet,Will grow in wet areas (not submerged). Spreads through rhizomes.2513,Sentimental Blue Balloon Flower,Platycodon grandiflorus,10 in,14 in,Mound,Mid-summer;      Late summer,Arrive late in spring - mark location with early bulbs tulips or daffodils,Blue,Border;      Rock garden,Full sun;      Part sun,"3, 4, 5, 6, 7, 8",Prefers well-drained, 2700,Sentimental Journey Betony,Stachys macrantha,8 in,15 in,Trailing,Mid-spring;     late spring;     Early summer;     Mid-summer;     Late summer,delicate orchid like flowers,Purple,Border,Full sun;      Part sun,Annual, , 590,Sentinel Crabapple,Malus,20 ft,12 ft,Upright, ,Rose colored flower buds open to spring flowers are white tinged with pink. Glossy green summer foliage; bright red fruits in late summer persist into winter.,Pink; White,Attract wildlife; Boulevard planting; Pollinator garden; Street tree,Full sun,"4, 5, 6, 7",Prefers acidic; Prefers well-drained,Good small  narrow Crabapple for small areas such as boulevards and under utility lines. Good for pollinators. Blooms on old wood.411,Sentry Ginkgo,Ginkgo biloba,50 ft,30 ft,Pyramidal, ,Fall yellow foliage., ,Street tree,Full sun,"4, 5, 6, 7, 8", ,Seedless male selection.322,September Beauty Summersweet,Clethra alnifolia,6 ft,4 ft,Rounded,Fall;      Summer,Compact Summersweet cultivar; flowers bloom on the current year s growth;  for 4-6 weeks from mid-August to late September.,White,Border;      Foundation planting;      Fragrance;      Pollinator garden,Full sun,"4, 5, 6, 7, 8, 9", ,Fragrant flowers  glossy green leaves. The blooms are attractive to butterflies and bees. Blooms on new wood.1571,Serbian Bellflower,Campanula poscharskyana,8 in,15 in,Creeping,Late spring;      Early summer, ,Blue,Border,Full sun;      Part sun,"4, 5, 6, 7",Tolerates dry, 705,Serbian Pimoko Spruce,Picea omorika,5 ft,5 ft,Globe;     Irregular,Spring;      Summer;      Fall;      Winter;      Year-round, , ,Focal point,Full sun;      Part sun,"2, 3, 4, 5, 6, 7, 8", ,Dense  dwarf form of Serbian spruce with distinctly bicolor foliage. While globe shaped as a young specimen  the form will become irregular as the tree matures.703,Serbian Spruce,Picea omorika,55 ft,30 ft,Pyramidal,Winter; Year-round; Spring; Summer; Fall,Glossy dark green needles all year with 2 distinctive;  broad white bands on the lower surface, ,Focal point; Hedge; Screen,Full sun; Part sun,"4, 5, 6, 7",Adaptable; Prefers evenly-moist; Tolerates dry,Narrowly pyramidal form;. One of the more adaptable spruces that appears to tolerate dry conditions.707,Serbian Weeping Bruns Spruce,Picea omorika,30 ft,6 ft,Weeping,Winter; Year-round; Spring; Summer; Fall, , , ,Full sun; Part sun,"4, 5, 6, 7", ,A selection from Bruns Nursery in Germany selected for its strong weeping habit.706,Serbian Weeping Spruce,Picea omorika,30 ft,15 ft,Weeping, , , , ,Full sun; Part sun,"4, 5, 6, 7", ,An attractive evergreen with gracefully weeping branches and distinctive bicolor foliage. May suffer some winter burn.536,Serotina Honeysuckle,Lonicera periclymenum,15 ft,  ft,Twining,Early fall;    Late summer;    Mid-summer,Red berry-like fruits are produced after flowering., , ,Full sun, , ,Blooms on old wood.